href,aria_label
https://www.facebook.com/dhakatribune,Facebook
https://twitter.com/DhakaTribune,Twitter
https://www.pinterest.com/dhakatribuneonline,Pinterest
https://www.youtube.com/DhakaTribuneOnline,YouTube
https://www.linkedin.com/company/dhaka-tribune,LinkedIn
https://www.instagram.com/dhakatribune,Instagram
https://news.google.com/publications/CAAqBwgKMMitpQswi7i9Aw?ceid=US:en,Google News
https://www.dhakatribune.com///www.dhakatribune.com/bangladesh/dhaka/380495/khaleda-along-with-two-daughters-in-law-reaches,Khaleda along with two daughters-in-law reaches Firoza
https://www.dhakatribune.com///www.dhakatribune.com/bangladesh/380500/shafiqul-10-days-holiday-for-eid-ul-azha,Eid-ul-Azha brings 10-day holiday this year
https://www.dhakatribune.com///www.dhakatribune.com/bangladesh/government-affairs/380494/ali-riaz-second-phase-of-dialogue-soon-after-may,Ali Riaz: Second phase of dialogue soon after May 15
https://www.dhakatribune.com///www.dhakatribune.com/bangladesh/dhaka/380487/khaleda-lands-in-dhaka,Khaleda lands in Dhaka
https://www.dhakatribune.com///www.dhakatribune.com/bangladesh/government-affairs/380493/ncp-submits-outlines-to-consensus-commission-for,NCP submits outlines to Consensus Commission for basic reforms
https://www.dhakatribune.com///www.dhakatribune.com/bangladesh/380489/fakhrul-khaleda%E2%80%99s-return-to-help-restore,Fakhrul: Khaleda’s return to help restore democracy
https://www.dhakatribune.com///www.dhakatribune.com/opinion/op-ed/380476/the-woes-of-entrepreneurs-in-bangladesh,The woes of entrepreneurs in Bangladesh
https://www.dhakatribune.com///www.dhakatribune.com/opinion/op-ed/380477/wrong-way-drivers-and-the-art-of-governance,Wrong-way drivers and the art of governance
https://www.dhakatribune.com///www.dhakatribune.com/opinion/specials/380475/climate-change-and-its-impact-on-regional,Climate change and its impact on regional security: A South Asian perspective
https://www.dhakatribune.com///www.dhakatribune.com/opinion/editorial/380474/a-higher-tax-free-income-ceiling-is-the-correct,A higher tax-free income ceiling is the correct move
https://www.dhakatribune.com///www.dhakatribune.com/opinion/editorial/380473/local-investment-building-our-future,Local investment building our future
https://www.dhakatribune.com///www.dhakatribune.com/bangladesh/government-affairs/380498/press-wing-debunks-the-hindu-report-on-targeting,Press wing debunks The Hindu report on targeting journalists by government
https://www.dhakatribune.com///www.dhakatribune.com/bangladesh/380485/advance-train-ticket-sales-for-eid-ul-azha-to,Advance train ticket sales for Eid-ul-Azha to begin on May 21
https://www.dhakatribune.com///www.dhakatribune.com/bangladesh/380486/cngs-motorcycles-allowed-on-expressway-for-six,"CNGs, motorcycles allowed on expressway for 6 hours Tuesday"
https://www.dhakatribune.com///www.dhakatribune.com/bangladesh/nation/380491/hero-alom-sued-for-rape-and-abuse-over-false,"Hero Alom sued for rape, abuse over false marriage, stardom promises"
https://www.dhakatribune.com///www.dhakatribune.com/bangladesh/health/380467/what-are-the-key-proposals-of-the-health-reform,What are the key proposals of the Health Reform Commission?
https://www.dhakatribune.com///www.dhakatribune.com/bangladesh/380483/bnp-activists-flock-to-airport-to-welcome-khaleda,Thousands of BNP activists flood Dhaka roads to welcome Khaleda
https://www.dhakatribune.com///www.dhakatribune.com/business/380479/national-food-security-policy-now-top-priority,Commerce Adviser: National food security policy now top priority
https://www.dhakatribune.com///www.dhakatribune.com/bangladesh/380488/child-dies-after-choking-on-lychee-seed-in-sherpur,Child dies after choking on lychee seed in Sherpur
https://www.dhakatribune.com///www.dhakatribune.com/bangladesh/politics/380496/sarjis-alam-welcomes-khaleda-zia-in-facebook-post,Sarjis Alam welcomes Khaleda Zia in Facebook post
https://www.dhakatribune.com///www.dhakatribune.com/bangladesh/nation/380492/female-worker-killed-by-speeding-truck-in-gazipur,Workers block highway in protest after colleague killed by truck in Gazipur
https://www.dhakatribune.com///www.dhakatribune.com/bangladesh/dhaka/380490/ncp-joins-talks-with-consensus-commission-for-2nd,NCP joins talks with Consensus Commission for 2nd day
https://www.dhakatribune.com///www.dhakatribune.com/video/379032/%E0%A6%A8%E0%A6%BF%E0%A6%B0%E0%A7%8D%E0%A6%AC%E0%A6%BE%E0%A6%9A%E0%A6%A8-%E0%A6%A8%E0%A6%BF%E0%A6%AF%E0%A6%BC%E0%A7%87-%E0%A6%9C%E0%A6%BE%E0%A6%A4%E0%A7%80%E0%A6%AF%E0%A6%BC-%E0%A6%A8%E0%A6%BE%E0%A6%97%E0%A6%B0%E0%A6%BF%E0%A6%95-%E0%A6%AA%E0%A6%BE%E0%A6%B0%E0%A7%8D%E0%A6%9F%E0%A6%BF%E0%A6%B0-%E0%A6%AD%E0%A6%BE%E0%A6%AC%E0%A6%A8%E0%A6%BE,নির্বাচন নিয়ে জাতীয় নাগরিক পার্টির ভাবনা
https://www.dhakatribune.com///www.dhakatribune.com/video/377781/%E0%A6%B9%E0%A6%BE%E0%A6%B0%E0%A6%BF%E0%A6%AF%E0%A6%BC%E0%A7%87-%E0%A6%AF%E0%A6%BE%E0%A6%93%E0%A6%AF%E0%A6%BC%E0%A6%BE-%E0%A6%AC%E0%A6%BF%E0%A6%96%E0%A7%8D%E0%A6%AF%E0%A6%BE%E0%A6%A4-%E0%A6%A2%E0%A6%BE%E0%A6%95%E0%A6%BE%E0%A6%87-%E0%A6%AE%E0%A6%B8%E0%A6%B2%E0%A6%BF%E0%A6%A8%E0%A7%87%E0%A6%B0-%E0%A6%AB%E0%A6%BF%E0%A6%B0%E0%A7%87-%E0%A6%86%E0%A6%B8%E0%A6%BE%E0%A6%B0,হারিয়ে যাওয়া বিখ্যাত ঢাকাই মসলিনের ফিরে আসার গল্প
https://www.dhakatribune.com///www.dhakatribune.com/video/377468/%E0%A6%88%E0%A6%A6%E0%A7%87%E0%A6%B0-%E0%A6%86%E0%A6%A8%E0%A6%A8%E0%A7%8D%E0%A6%A6%E0%A7%87-%E0%A6%8F%E0%A6%95-%E0%A6%B6%E0%A6%B9%E0%A6%B0-%E0%A6%A6%E0%A7%81%E0%A6%87-%E0%A6%AC%E0%A6%BE%E0%A6%B8%E0%A7%8D%E0%A6%A4%E0%A6%AC%E0%A6%A4%E0%A6%BE,"ঈদের আনন্দে এক শহর, দুই বাস্তবতা"
https://www.dhakatribune.com///www.dhakatribune.com/video/377434/%E0%A6%88%E0%A6%A6%E0%A6%AF%E0%A6%BE%E0%A6%A4%E0%A7%8D%E0%A6%B0%E0%A6%BE%E0%A6%AF%E0%A6%BC-%E0%A6%9F%E0%A7%8D%E0%A6%B0%E0%A7%87%E0%A6%A8%E0%A7%87-%E0%A6%98%E0%A6%B0%E0%A6%AE%E0%A7%81%E0%A6%96%E0%A7%8B-%E0%A6%AE%E0%A6%BE%E0%A6%A8%E0%A7%81%E0%A6%B7,ঈদযাত্রায় ট্রেনে ঘরমুখো মানুষ
https://www.dhakatribune.com///www.dhakatribune.com/video/376028/%E0%A6%A8%E0%A6%BE%E0%A6%B0%E0%A7%80%E0%A6%B0%E0%A6%BE-%E0%A6%A4%E0%A6%BE%E0%A6%A6%E0%A7%87%E0%A6%B0-%E0%A6%A8%E0%A6%BF%E0%A6%B0%E0%A6%BE%E0%A6%AA%E0%A6%A4%E0%A7%8D%E0%A6%A4%E0%A6%BE-%E0%A6%A8%E0%A6%BF%E0%A6%AF%E0%A6%BC%E0%A7%87-%E0%A6%95%E0%A6%A4%E0%A6%9F%E0%A6%BE-%E0%A6%B6%E0%A6%99%E0%A7%8D%E0%A6%95%E0%A6%BF%E0%A6%A4,নারীরা তাদের নিরাপত্তা নিয়ে কতটা শঙ্কিত ?
https://www.dhakatribune.com///www.dhakatribune.com/feature/tech/380054/best-tv-brands-in-bangladesh-navigating-the-2025,Best TV brands in Bangladesh: Navigating the 2025 market with confidence
https://www.dhakatribune.com///www.dhakatribune.com/feature/youth/379936/grow-your-reader-foundation-launches-int%E2%80%99l-youth,Grow Your Reader Foundation launches int’l youth exchange project
https://www.dhakatribune.com///www.dhakatribune.com/feature/youth/379884/shahi-al-sadat-unveils-online-shopping-platform,Shahi Al Sadat unveils online shopping platform ‘What’
https://www.dhakatribune.com///www.dhakatribune.com/feature/travel/379162/a-ride-on-the-dark-night-express,A ride on the Dark Night Express
https://www.dhakatribune.com///www.dhakatribune.com/feature/tech/379035/realme-launches-ultra-waterproof-smartphone-c75x,realme launches ultra-waterproof smartphone C75x
https://www.dhakatribune.com///www.dhakatribune.com/photo-gallery/378661/in-pictures-nation-celebrates-pohela-boishakh,"In pictures: Nation celebrates Pohela Boishakh with colour, culture and joy"
https://www.dhakatribune.com///www.dhakatribune.com/photo-gallery/370134/in-pictures-a-forgotten-art-form-kept-alive-at,In pictures: A forgotten art form kept alive at Rajmoni Circus
https://www.dhakatribune.com///www.dhakatribune.com/world/north-america/364361/in-pictures-us-election-2024,In pictures: Scenes from US election 2024
https://www.dhakatribune.com///www.dhakatribune.com/photo-gallery/360971/in-pictures-artisans-bring-goddess-durga-to-life,In pictures: Artisans bring Goddess Durga to life
https://www.dhakatribune.com///www.dhakatribune.com/bangladesh/355908/in-pictures-drik-gallery-hosts-exhibition-titled,In pictures:  Drik Gallery hosts exhibition titled ‘Cartoon ay Bidroho (Revolution in Cartoons)’
https://www.dhakatribune.com///www.dhakatribune.com/sport/tennis/380484/all-roads-lead-to-rome-open-for-sinner,All roads lead to Rome Open for Sinner
https://www.dhakatribune.com///www.dhakatribune.com/sport/football/380482/donnarumma-stands-tall-on-psg-s-champions-league,Donnarumma stands tall on PSG's Champions League run
https://www.dhakatribune.com///www.dhakatribune.com/sport/football/380481/odegaard-arsenal-must-stick-together-in-psg,Odegaard: Arsenal must stick together in PSG showdown
https://www.dhakatribune.com///www.dhakatribune.com/sport/cricket/380478/rabada-back-in-ipl-after-serving-ban,Rabada back in IPL after serving ban
https://www.dhakatribune.com///www.dhakatribune.com/sport/cricket/380472/miraz-nominated-for-icc%E2%80%99s-player-of-the-month,Miraz nominated for ICC’s Player of the Month award
https://www.dhakatribune.com///www.dhakatribune.com/business/banks/380462/syed-mizanur-rahman-appointed-md-ceo-of-ab-bank,Syed Mizanur Rahman appointed MD & CEO of AB Bank
https://www.dhakatribune.com///www.dhakatribune.com/business/banks/380455/prime-bank-holds-30th-agm-virtually,Prime Bank holds 30th AGM virtually
https://www.dhakatribune.com///www.dhakatribune.com/business/380450/inclusive-workplace-policies-and-culture-are,Inclusive workplace policies and culture are essential for social and economic justice
https://www.dhakatribune.com///www.dhakatribune.com/business/380448/al-arafah-islami-bank-inaugurates-development,Al-Arafah Islami Bank inaugurates development program for MTOs
https://www.dhakatribune.com///www.dhakatribune.com/showtime/380351/stuntman-of-shakib-s-taandob-dead,Stuntman of Shakib Khan's 'Taandob' dies on set
https://www.dhakatribune.com///www.dhakatribune.com/showtime/380197/from-comilla-to-cannes,Haru's journey from Comilla to Cannes
https://www.dhakatribune.com///www.dhakatribune.com/showtime/380204/5-short-films-by-5-young-filmmakers,5 short films by 5 young filmmakers streaming now
https://www.dhakatribune.com///www.dhakatribune.com/showtime/380285/netflix-s-the-eternaut-echoes-fight-against,Netflix's 'The Eternaut' echoes fight against tyranny
https://www.dhakatribune.com///www.dhakatribune.com/showtime/379994/%E2%80%98jaya-ar-sharmin%E2%80%99-coming-soon,‘Jaya ar Sharmin’ coming soon
